{"skill_invocation":"$release-readiness-checklist","package_name":"clip-clean","expected_version":"1.4.0","report_json":"reports/release-readiness.json","report_markdown":"reports/release-readiness.md","release_exit_code":0,"tests_command":"npm test","tests_status":"passed","notes":"Generated dry-run reports with checklist rows preserved; evidence collector exited 0 and npm test passed (2/2). No release action or version/changelog/install-command edits were performed; only reports/ remains untracked."}
